{
  "$schema": "https://json-schema.org/draft/2020-12/schema",
  "$id": "https://github.com/globalmindsolution/gms-marketplace/src/acs/schemas/verdict.schema.json",
  "title": "acs verifier verdict",
  "description": "The verifier's verdict for one iteration (MAR-527), written by the verifier and validated by the SubagentStop hook. NOTE: the invariant that makes this a verdict rather than a self-report -- `passed` must equal \"no blocking finding\" -- is NOT expressible here and is enforced by acs_lib.verdict.validate_verdict, which is what the hook actually runs. This schema pins the shape; that function pins the meaning.",
  "type": "object",
  "additionalProperties": true,
  "required": [
    "skill",
    "ticket_id",
    "iteration",
    "passed",
    "dimensions",
    "findings"
  ],
  "properties": {
    "skill": {
      "type": "string",
      "minLength": 1
    },
    "ticket_id": {
      "type": "string",
      "minLength": 1
    },
    "iteration": {
      "type": "integer",
      "minimum": 1
    },
    "lens": {
      "description": "The full-depth review lens this verdict covers, or null for a single-pass (light-depth) verdict and for the merged one.",
      "type": [
        "string",
        "null"
      ],
      "enum": [
        "A",
        "B",
        "C",
        "D",
        null
      ]
    },
    "passed": {
      "description": "DERIVED, never asserted: true exactly when `findings` carries no entry with severity `blocking`.",
      "type": "boolean"
    },
    "merged_from": {
      "description": "Present only on a merged verdict: the lenses it was built from.",
      "type": "array",
      "items": {
        "type": "string",
        "enum": [
          "A",
          "B",
          "C",
          "D"
        ]
      }
    },
    "dimensions": {
      "type": "array",
      "minItems": 1,
      "items": {
        "type": "object",
        "additionalProperties": true,
        "required": [
          "id",
          "result"
        ],
        "properties": {
          "id": {
            "type": "integer",
            "minimum": 1,
            "maximum": 16,
            "description": "The dimension number in src/acs/agents/code-verifier.md."
          },
          "name": {
            "type": "string"
          },
          "result": {
            "type": "string",
            "enum": [
              "pass",
              "fail",
              "n/a"
            ],
            "description": "`n/a` is a real answer: dimension 14 is full-depth only, 15 is inactive without an approved plan, 2 and 3 are n/a under docs_only."
          },
          "evidence": {
            "type": "string",
            "description": "The command run and its relevant output, or the file:line the judgement rests on."
          }
        }
      }
    },
    "findings": {
      "type": "array",
      "items": {
        "type": "object",
        "additionalProperties": true,
        "required": [
          "severity",
          "detail"
        ],
        "properties": {
          "severity": {
            "type": "string",
            "enum": [
              "blocking",
              "info"
            ],
            "description": "Only `blocking` decides the verdict; `info` is reported and carried, never gating."
          },
          "dimension": {
            "type": "string"
          },
          "detail": {
            "type": "string",
            "minLength": 1
          },
          "file": {
            "type": "string"
          },
          "line": {
            "type": "integer"
          }
        }
      }
    },
    "written_at": {
      "type": "string"
    },
    "tests": {
      "type": "object",
      "description": "The verifier's own run of the full unit suite (dimension 2), as numbers rather than prose. /acs:code runs that suite once, in verify; the executor iterates against the tests its change touches. states.tests is derived from here, so the recorded result is the review's independent finding rather than the executor's self-report. Optional: a docs-only ticket has no coverage to record, and a run can end before any verifier writes a verdict -- acs_lib.derive_tests falls back to the execute reports then.",
      "properties": {
        "passed": {"type": "integer", "minimum": 0},
        "failed": {"type": "integer", "minimum": 0},
        "command": {"type": "string"},
        "skipped": {"type": "string", "description": "Why no run was taken on this iteration. The verifier judges the reading dimensions first and defers the suite when one of them already blocks -- the changeset is going back to the executor, so a run against this tree answers a question nobody will ask. A deferral is never a pass: a zero-findings verdict requires a green run on the iteration being passed."}
      },
      "additionalProperties": true
    },
    "coverage": {
      "type": "object",
      "description": "Coverage read off the SAME run recorded in `tests` (dimension 3), not a second one: on most repos the test command reports coverage because it is the command the coverage gate runs. `percent` is the measured figure; the target it is judged against comes from settings.test_coverage_percent, never from here.",
      "properties": {
        "percent": {"type": "number", "minimum": 0, "maximum": 100},
        "command": {"type": "string"},
        "skipped": {"type": "string", "description": "Deferred with the dimension-2 run it is read from; same rule."}
      },
      "additionalProperties": true
    }
  }
}
