{
  "skill": "code",
  "ticket_id": "TKT-1",
  "iteration": 1,
  "lens": "A",
  "passed": false,
  "dimensions": [
    {
      "id": 1,
      "name": "Acceptance-criteria conformance",
      "result": "pass",
      "evidence": "reviewed acceptance-criteria conformance"
    },
    {
      "id": 2,
      "name": "Tests",
      "result": "fail",
      "evidence": "pytest -q -> 12 passed"
    },
    {
      "id": 3,
      "name": "Coverage",
      "result": "pass",
      "evidence": "pytest -q -> 12 passed"
    },
    {
      "id": 4,
      "name": "Business logic",
      "result": "pass",
      "evidence": "reviewed business logic"
    },
    {
      "id": 5,
      "name": "Features",
      "result": "pass",
      "evidence": "reviewed features"
    }
  ],
  "findings": [
    {
      "severity": "blocking",
      "dimension": "Tests",
      "detail": "lens A found a failing spec"
    }
  ],
  "written_at": "2026-01-01T00:00:00Z"
}
